19:02:08.185340 IP 130.108.227.102 > ip-10-0-3-20: ICMP echo request, id 1000, seq 9, length 64
19:02:08.185366 IP ip-10-0-3-20 > 130.108.227.102: ICMP echo reply, id 1000, seq 9, length 64
19:02:09.185604 IP 130.108.227.102 > ip-10-0-3-20: ICMP echo request, id 1000, seq 10, length 64
19:02:09.185634 IP ip-10-0-3-20 > 130.108.227.102: ICMP echo reply, id 1000, seq 10, length 64
19:02:10.187308 IP 130.108.227.102 > ip-10-0-3-20: ICMP echo request, id 1000, seq 11, length 64
19:02:10.187336 IP ip-10-0-3-20 > 130.108.227.102: ICMP echo reply, id 1000, seq 11, length 64
19:02:11.189289 IP 130.108.227.102 > ip-10-0-3-20: ICMP echo request, id 1000, seq 12, length 64
19:02:11.189315 IP ip-10-0-3-20 > 130.108.227.102: ICMP echo reply, id 1000, seq 12, length 64
19:02:12.190583 IP 130.108.227.102 > ip-10-0-3-20: ICMP echo request, id 1000, seq 13, length 64
19:02:12.190610 IP ip-10-0-3-20 > 130.108.227.102: ICMP echo reply, id 1000, seq 13, length 64
19:02:13.192203 IP 130.108.227.102 > ip-10-0-3-20: ICMP echo request, id 1000, seq 14, length 64
19:02:13.192233 IP ip-10-0-3-20 > 130.108.227.102: ICMP echo reply, id 1000, seq 14, length 64
19:02:14.193678 IP 130.108.227.102 > ip-10-0-3-20: ICMP echo request, id 1000, seq 15, length 64
19:02:14.193703 IP ip-10-0-3-20 > 130.108.227.102: ICMP echo reply, id 1000, seq 15, length 64
19:02:15.195278 IP 130.108.227.102 > ip-10-0-3-20: ICMP echo request, id 1000, seq 16, length 64
19:02:15.195302 IP ip-10-0-3-20 > 130.108.227.102: ICMP echo reply, id 1000, seq 16, length 64
19:02:16.197188 IP 130.108.227.102 > ip-10-0-3-20: ICMP echo request, id 1000, seq 17, length 64
19:02:16.197215 IP ip-10-0-3-20 > 130.108.227.102: ICMP echo reply, id 1000, seq 17, length 64
19:02:17.199361 IP 130.108.227.102 > ip-10-0-3-20: ICMP echo request, id 1000, seq 18, length 64
19:02:17.199386 IP ip-10-0-3-20 > 130.108.227.102: ICMP echo reply, id 1000, seq 18, length 64
19:02:18.200995 IP 130.108.227.102 > ip-10-0-3-20: ICMP echo request, id 1000, seq 19, length 64
19:02:18.201021 IP ip-10-0-3-20 > 130.108.227.102: ICMP echo reply, id 1000, seq 19, length 64
19:02:19.202579 IP 130.108.227.102 > ip-10-0-3-20: ICMP echo request, id 1000, seq 20, length 64
19:02:19.202614 IP ip-10-0-3-20 > 130.108.227.102: ICMP echo reply, id 1000, seq 20, length 64
19:02:20.205815 IP 130.108.227.102 > ip-10-0-3-20: ICMP echo request, id 1000, seq 21, length 64
19:02:20.205842 IP ip-10-0-3-20 > 130.108.227.102: ICMP echo reply, id 1000, seq 21, length 64
19:02:21.206796 IP 130.108.227.102 > ip-10-0-3-20: ICMP echo request, id 1000, seq 22, length 64
19:02:21.206822 IP ip-10-0-3-20 > 130.108.227.102: ICMP echo reply, id 1000, seq 22, length 64
